{
  "$schema": "http://json-schema.org/draft-07/schema#",
  "$id": "https://agent-os.dev/schemas/policy.json",
  "title": "Policy Specification",
  "description": "Schema for defining a Policy in Agent OS",
  "type": "object",
  "required": ["id", "name", "version", "rules"],
  "properties": {
    "id": {
      "type": "string",
      "pattern": "^[a-z0-9-]+$",
      "description": "Unique identifier for the policy"
    },
    "name": {
      "type": "string",
      "description": "Human-readable name"
    },
    "version": {
      "type": "string",
      "pattern": "^\\d+\\.\\d+\\.\\d+$",
      "description": "Semantic version"
    },
    "description": {
      "type": "string",
      "description": "Policy description"
    },
    "rules": {
      "type": "array",
      "items": {
        "type": "object",
        "required": ["type", "config"],
        "properties": {
          "type": {
            "type": "string",
            "enum": ["rate_limit", "cost_limit", "allowed_tools", "forbidden_actions"]
          },
          "config": {
            "type": "object"
          }
        }
      },
      "description": "List of policy rules"
    }
  }
}
